{
  "summary": "將 CI runner capacity 從 3 增至 6，其他參數不變。",
  "assumptions": [
    "服務時間分布不變。"
  ],
  "risk_level": "low",
  "confidence": 0.96,
  "changes": [
    {
      "op": "test",
      "path": "/resources/1/id",
      "value": "ci_runner"
    },
    {
      "op": "replace",
      "path": "/resources/1/capacity",
      "value": 6
    }
  ],
  "expected_effects": [
    "CI queue waiting 可能下降；仍需模擬。"
  ],
  "requires_confirmation": true,
  "proposal_id": "aip_01M4YDQK00ADN261CME3WV5HZ6",
  "organization_id": "org_01M4YDQK00Y5H2929M9WWZWTVH",
  "model_id": "mdl_01M4YDQK004AGVNEGJQJ1NMM0N",
  "base_version_id": "mv_01M4YDQK00FRYWV7GS7X1QCXZR",
  "mode": "edit",
  "status": "ready",
  "created_by": "usr_01M4YDQK0016KTK4JM6KAHZ6BR",
  "created_at": "2026-10-15T08:30:00Z",
  "validation": {
    "valid": true,
    "issues": []
  },
  "patch_hash": "sha256:0000000000000000000000000000000000000000000000000000000000000000",
  "server_risk_level": "low",
  "provider_risk_claim": "low",
  "generated_by": {
    "provider": "meta",
    "model": "muse-spark-1.3",
    "web_search": {
      "queries": 4,
      "sources_dropped": 1
    }
  },
  "sources": [
    {
      "url": "https://example.com/geminus-fake-research/smt-line-balancing",
      "title": "SMT line balancing (test page)"
    },
    {
      "url": "https://example.org/reflow-oven-throughput"
    }
  ]
}
