{
  "proposal_id": "aip_01M4YDQK00ADN261CME3WV5HZ7",
  "organization_id": "org_01M4YDQK00Y5H2929M9WWZWTVH",
  "model_id": "mdl_01M4YDQK004AGVNEGJQJ1NMM0N",
  "base_version_id": "mv_01M4YDQK00FRYWV7GS7X1QCXZR",
  "mode": "edit",
  "status": "generating",
  "created_by": "usr_01M4YDQK0016KTK4JM6KAHZ6BR",
  "created_at": "2026-10-20T08:30:00Z",
  "requires_confirmation": true
}
