{
  "summary": "Let more CI runs pass: 90% pass and 10% go to rework, instead of 80% and 20%.",
  "assumptions": [
    "The CI failure rate falls with the test fixes; the other parameters stay the same."
  ],
  "confidence": 0.7,
  "changes": [
    {
      "op": "test",
      "path": "/flows/3/id",
      "value": "f_pass"
    },
    {
      "op": "replace",
      "path": "/flows/3/routing/probability",
      "value": 0.9
    },
    {
      "op": "test",
      "path": "/flows/4/id",
      "value": "f_retry"
    },
    {
      "op": "replace",
      "path": "/flows/4/routing/probability",
      "value": 0.1
    }
  ],
  "expected_effects": [
    "Fewer changes may go back to rework; a simulation will tell by how much."
  ],
  "requires_confirmation": true,
  "proposal_id": "aip_01M4YDQK00ADN261CME3WV5HZC",
  "organization_id": "org_01M4YDQK00Y5H2929M9WWZWTVH",
  "model_id": "mdl_01M4YDQK004AGVNEGJQJ1NMM0N",
  "base_version_id": "mv_01M4YDQK00FRYWV7GS7X1QCXZR",
  "mode": "edit",
  "status": "ready",
  "created_by": "usr_01M4YDQK0016KTK4JM6KAHZ6BR",
  "created_at": "2026-10-31T08:30:00Z",
  "validation": {
    "valid": true,
    "issues": []
  },
  "patch_hash": "sha256:0000000000000000000000000000000000000000000000000000000000000000",
  "server_risk_level": "medium",
  "provider_risk_claim": "low",
  "risk_level": "medium",
  "dataset_bindings": [],
  "generated_by": {
    "provider": "meta",
    "model": "muse-spark-1.3",
    "revised_after_check": true
  }
}
