{
  "summary": "將 CI runner capacity 從 3 增至 6，其他參數不變。",
  "assumptions": [
    "服務時間分布不變。"
  ],
  "risk_level": "low",
  "confidence": 0.96,
  "changes": [
    {
      "op": "test",
      "path": "/resources/1/id",
      "value": "ci_runner"
    },
    {
      "op": "replace",
      "path": "/resources/1/capacity",
      "value": 6
    }
  ],
  "expected_effects": [
    "CI queue waiting 可能下降；仍需模擬。"
  ],
  "requires_confirmation": true,
  "proposal_id": "aip_01M4YDQK00ADN261CME3WV5HZ6",
  "organization_id": "org_01M4YDQK00Y5H2929M9WWZWTVH",
  "model_id": "mdl_01M4YDQK004AGVNEGJQJ1NMM0N",
  "base_version_id": "mv_01M4YDQK00FRYWV7GS7X1QCXZR",
  "mode": "edit",
  "status": "ready",
  "created_by": "usr_01M4YDQK0016KTK4JM6KAHZ6BR",
  "created_at": "2026-10-15T08:30:00Z",
  "validation": {
    "valid": true,
    "issues": []
  },
  "patch_hash": "sha256:0000000000000000000000000000000000000000000000000000000000000000",
  "server_risk_level": "low",
  "provider_risk_claim": "low",
  "source_image": {
    "media_type": "image/png",
    "width": 1200,
    "height": 520,
    "size_bytes": 21843,
    "content_hash": "sha256:1111111111111111111111111111111111111111111111111111111111111111"
  },
  "generated_by": {
    "provider": "meta",
    "model": "muse-spark-1.3",
    "segmenter": {
      "provider": "meta",
      "model": "sam-3.1",
      "objects": 3,
      "boxes": [
        {
          "concept": "smt line",
          "x1": 40,
          "y1": 190,
          "x2": 229,
          "y2": 309,
          "confidence": 0.93
        },
        {
          "concept": "aoi machine",
          "x1": 330,
          "y1": 200,
          "x2": 449,
          "y2": 299,
          "confidence": 0.93
        },
        {
          "concept": "conveyor belt",
          "x1": 230,
          "y1": 242,
          "x2": 329,
          "y2": 257,
          "confidence": 0.81
        }
      ]
    }
  }
}
